PokerStars Hand #234650075954:  Fusion Pot Limit (0.01/0.02 EUR) - 2022/03/08 18:51:01 CET [2022/03/08 12:51:01 ET]
Table 'Tynka' 6-max Seat #2 is the button
Seat 1: lolobob (2.47 in chips) 
Seat 2: aralnama (3.44 in chips) 
Seat 3: madre974 (4.16 in chips) 
Seat 4: jeje_sat (2 in chips) 
Seat 6: Massilia1972 (1.72 in chips) 
madre974: posts small blind 0.01
jeje_sat: posts big blind 0.02
*** HOLE CARDS ***
Dealt to jeje_sat [9d 8h]
Massilia1972: folds 
lolobob: folds 
aralnama: calls 0.02
madre974: calls 0.01
jeje_sat: checks 
*** FLOP *** [4h 9h Jc]
Dealt to jeje_sat [9d 8h] [Qh]
madre974: bets 0.02
jeje_sat: calls 0.02
aralnama: calls 0.02
*** TURN *** [4h 9h Jc] [Kd]
Dealt to jeje_sat [9d 8h Qh] [8d]
madre974: bets 0.11
jeje_sat: calls 0.11
aralnama: folds 
*** RIVER *** [4h 9h Jc Kd] [Ah]
madre974: bets 0.32
jeje_sat: calls 0.32
*** SHOW DOWN ***
madre974: shows [Ks 2h 9c 5h] (a flush, Ace high)
jeje_sat: shows [9d 8h Qh 8d] (a flush, Ace high - Queen higher)
jeje_sat collected 0.92 from pot
*** SUMMARY ***
Total pot 0.98 | Rake 0.06 
Board [4h 9h Jc Kd Ah]
Seat 1: lolobob folded before Flop (didn't bet)
Seat 2: aralnama (button) folded on the Turn
Seat 3: madre974 (small blind) showed [Ks 2h 9c 5h] and lost with a flush, Ace high
Seat 4: jeje_sat (big blind) showed [9d 8h Qh 8d] and won (0.92) with a flush, Ace high
Seat 6: Massilia1972 folded before Flop (didn't bet)



PokerStars Hand #234650091790:  Fusion Pot Limit (0.01/0.02 EUR) - 2022/03/08 18:51:34 CET [2022/03/08 12:51:34 ET]
Table 'Tynka' 6-max Seat #3 is the button
Seat 1: lolobob (2.47 in chips) 
Seat 2: aralnama (3.40 in chips) 
Seat 3: madre974 (3.69 in chips) 
Seat 4: jeje_sat (2.45 in chips) 
Seat 6: Massilia1972 (1.72 in chips) 
jeje_sat: posts small blind 0.01
Massilia1972: posts big blind 0.02
*** HOLE CARDS ***
Dealt to jeje_sat [Qd 4s]
lolobob: calls 0.02
aralnama: calls 0.02
madre974: raises 0.09 to 0.11
jeje_sat: folds 
Massilia1972: folds 
lolobob: calls 0.09
aralnama: calls 0.09
*** FLOP *** [6d 6c 4d]
lolobob: checks 
aralnama: checks 
madre974: bets 0.14
lolobob: folds 
aralnama: calls 0.14
*** TURN *** [6d 6c 4d] [9d]
aralnama: checks 
madre974: checks 
*** RIVER *** [6d 6c 4d 9d] [9s]
aralnama: checks 
madre974: bets 0.40
aralnama: folds 
Uncalled bet (0.40) returned to madre974
madre974 collected 0.60 from pot
madre974: doesn't show hand 
*** SUMMARY ***
Total pot 0.64 | Rake 0.04 
Board [6d 6c 4d 9d 9s]
Seat 1: lolobob folded on the Flop
Seat 2: aralnama folded on the River
Seat 3: madre974 (button) collected (0.60)
Seat 4: jeje_sat (small blind) folded before Flop
Seat 6: Massilia1972 (big blind) folded before Flop



PokerStars Hand #234650112191:  Fusion Pot Limit (0.01/0.02 EUR) - 2022/03/08 18:52:17 CET [2022/03/08 12:52:17 ET]
Table 'Tynka' 6-max Seat #4 is the button
Seat 1: lolobob (2.36 in chips) 
Seat 2: aralnama (3.15 in chips) 
Seat 3: madre974 (4.04 in chips) 
Seat 4: jeje_sat (2.44 in chips) 
Seat 6: Massilia1972 (1.70 in chips) 
Massilia1972: posts small blind 0.01
lolobob: posts big blind 0.02
*** HOLE CARDS ***
Dealt to jeje_sat [8d 2d]
aralnama: calls 0.02
madre974: raises 0.02 to 0.04
jeje_sat: folds 
Massilia1972: folds 
lolobob: calls 0.02
aralnama: calls 0.02
*** FLOP *** [Ad Jd 3c]
lolobob: checks 
aralnama: checks 
madre974: bets 0.02
lolobob: calls 0.02
aralnama: calls 0.02
*** TURN *** [Ad Jd 3c] [Kd]
lolobob: checks 
aralnama: checks 
madre974: bets 0.02
lolobob: calls 0.02
aralnama: raises 0.12 to 0.14
madre974: calls 0.12
lefum96 joins the table at seat #5 
lolobob: calls 0.12
*** RIVER *** [Ad Jd 3c Kd] [3s]
lolobob: checks 
aralnama: bets 0.28
madre974: calls 0.28
lolobob: raises 1.41 to 1.69
aralnama: folds 
madre974: calls 1.41
*** SHOW DOWN ***
lolobob: shows [As 4s 9s Ah] (a full house, Aces full of Threes)
madre974: mucks hand 
lolobob collected 4.12 from pot
*** SUMMARY ***
Total pot 4.27 | Rake 0.15 
Board [Ad Jd 3c Kd 3s]
Seat 1: lolobob (big blind) showed [As 4s 9s Ah] and won (4.12) with a full house, Aces full of Threes
Seat 2: aralnama folded on the River
Seat 3: madre974 mucked [6s 2c 3h 5h]
Seat 4: jeje_sat (button) folded before Flop (didn't bet)
Seat 6: Massilia1972 (small blind) folded before Flop



PokerStars Hand #234650146516:  Fusion Pot Limit (0.01/0.02 EUR) - 2022/03/08 18:53:30 CET [2022/03/08 12:53:30 ET]
Table 'Tynka' 6-max Seat #6 is the button
Seat 1: lolobob (4.59 in chips) 
Seat 2: aralnama (2.67 in chips) 
Seat 3: madre974 (2.15 in chips) 
Seat 4: jeje_sat (2.44 in chips) 
Seat 6: Massilia1972 (1.69 in chips) 
lolobob: posts small blind 0.01
aralnama: posts big blind 0.02
lefum96: sits out 
*** HOLE CARDS ***
Dealt to jeje_sat [2s 7d]
madre974: raises 0.02 to 0.04
jeje_sat: folds 
Massilia1972: folds 
lolobob: calls 0.03
aralnama: calls 0.02
*** FLOP *** [7c Ad 5c]
lolobob: checks 
aralnama: checks 
madre974: checks 
*** TURN *** [7c Ad 5c] [Ah]
lolobob: checks 
aralnama: checks 
madre974: bets 0.02
lolobob: calls 0.02
aralnama: calls 0.02
*** RIVER *** [7c Ad 5c Ah] [Kc]
lolobob: checks 
aralnama: checks 
madre974: bets 0.02
lolobob: folds 
aralnama: folds 
Uncalled bet (0.02) returned to madre974
madre974 collected 0.17 from pot
madre974: doesn't show hand 
*** SUMMARY ***
Total pot 0.18 | Rake 0.01 
Board [7c Ad 5c Ah Kc]
Seat 1: lolobob (small blind) folded on the River
Seat 2: aralnama (big blind) folded on the River
Seat 3: madre974 collected (0.17)
Seat 4: jeje_sat folded before Flop (didn't bet)
Seat 6: Massilia1972 (button) folded before Flop (didn't bet)



